{
  "schema": "openprose.runner-case/1",
  "id": "dx.dry-run-default-hosted",
  "summary": "The default dry run reports the hosted OpenProse identity and exact configuration provenance without starting a model.",
  "phase": 7,
  "tags": ["dry-run", "hosted", "configuration", "agent-dx", "differential"],
  "controls": {
    "fixedInvocationId": "fixture-invocation-0001",
    "fixedTimestamp": "2025-01-01T00:00:00Z",
    "fixedMonotonicMs": 0,
    "network": "denied"
  },
  "invocation": {
    "argv": ["--output", "json", "--dry-run", "write", "fixture request"],
    "cwd": "{{WORKSPACE}}",
    "environment": {}
  },
  "expected": {
    "exitCode": 10,
    "stdout": { "kind": "json", "schema": "openprose.runner-dry-run-report/1" },
    "stderr": { "kind": "empty" },
    "startedHarness": false,
    "resultFixture": "cli/shared/fixtures/dx/dry-run-default-hosted.json",
    "errorCode": "HOSTED_UNAVAILABLE",
    "errorAction": "Select an available BYO harness with the `cli harness use <id>` runner operation, then invoke the `cli doctor` runner operation."
  }
}
