{
  "schema": "openprose.runner-case/1",
  "id": "adapters.codex-functional-alpha",
  "summary": "The Codex installed-process adapter carries the opaque echo image and task through its admitted noninteractive interface.",
  "phase": 3,
  "tags": ["adapter", "codex", "functional-alpha", "provider-free", "differential"],
  "platforms": ["unix"],
  "controls": {
    "fixedInvocationId": "00000000-0000-7000-8000-000000000301",
    "fixedTimestamp": "2026-01-01T00:00:00.000Z",
    "fixedMonotonicMs": 300,
    "network": "denied",
    "installedAdapter": { "adapterId": "codex/exec-json" }
  },
  "invocation": {
    "argv": ["--harness", "codex", "--transport", "exec-json", "--model", "fixture/model:alpha", "--auth-profile", "cached-chatgpt-login", "--output", "json", "write", "Hello world"],
    "cwd": "{{WORKSPACE}}",
    "environment": {}
  },
  "expected": {
    "exitCode": 0,
    "stdout": { "kind": "json", "schema": "openprose.runner-result/1" },
    "stderr": { "kind": "empty" },
    "startedHarness": true,
    "resultMatches": {
      "adapter": { "id": "codex/exec-json" },
      "transport": "exec-json",
      "terminal": { "classification": "success", "transportCompleted": true, "terminalEventObserved": true, "exitCode": 0, "signal": null },
      "semantic": { "status": "not-applicable" },
      "billing": { "owner": "user-provider", "authCategory": "harness-managed" },
      "runnerExitCode": 0
    },
    "forwardedTask": { "argv": ["prose", "write", "Hello world"], "interactionMode": "non-interactive" }
  }
}
