{
  "schema": "openprose.runner-case/1",
  "id": "core.mock-success",
  "summary": "The deterministic mock completes the release-ineligible sentinel contract only.",
  "phase": 1,
  "tags": ["mock", "json", "sentinel", "offline"],
  "controls": {
    "fixedInvocationId": "fixture-invocation-0001",
    "fixedTimestamp": "2025-01-01T00:00:00Z",
    "fixedMonotonicMs": 0,
    "network": "denied"
  },
  "invocation": {
    "argv": ["--harness", "mock", "--output", "json", "run", "fixture.prose.md"],
    "cwd": "{{WORKSPACE}}",
    "environment": {}
  },
  "expected": {
    "exitCode": 0,
    "stdout": { "kind": "json", "schema": "openprose.runner-result/1" },
    "stderr": { "kind": "empty" },
    "startedHarness": true,
    "resultMatches": {
      "adapter": { "id": "mock/in-memory" },
      "languageImage": { "version": "sentinel-v1", "sha256": "ee13d1cbba24d1623523f4fe8747b4a3387cd6880f5d6fb4a360d2a7949ddf00" },
      "semantic": { "status": "not-applicable" },
      "billing": { "owner": "test-fixture", "authCategory": "none-test-only" },
      "runnerExitCode": 0
    },
    "forwardedTask": {
      "argv": ["prose", "run", "fixture.prose.md"],
      "interactionMode": "non-interactive"
    }
  }
}
