{
  "schema": "openprose.runner-case/1",
  "id": "transport.fake-success",
  "summary": "A directly spawned fake process delivers exact image and task bytes and completes structurally.",
  "phase": 1,
  "tags": ["fake-process", "image-exactness", "task-exactness", "json"],
  "controls": {
    "fixedInvocationId": "fixture-invocation-0001",
    "fixedTimestamp": "2025-01-01T00:00:00Z",
    "fixedMonotonicMs": 0,
    "network": "denied",
    "fakeHarness": { "scenario": "success" }
  },
  "invocation": {
    "argv": ["--harness", "mock", "--transport", "fake-process", "--output", "json", "run", "fixture.prose.md"],
    "cwd": "{{WORKSPACE}}",
    "environment": {}
  },
  "expected": {
    "exitCode": 0,
    "stdout": { "kind": "json", "schema": "openprose.runner-result/1" },
    "stderr": { "kind": "empty" },
    "startedHarness": true,
    "resultMatches": {
      "adapter": { "id": "mock/fake-process", "harnessVersion": "1.0.0" },
      "semantic": { "status": "not-applicable" },
      "runnerExitCode": 0
    },
    "forwardedTask": {
      "argv": ["prose", "run", "fixture.prose.md"],
      "interactionMode": "non-interactive"
    },
    "fakeObservation": { "exactImageBytes": true, "exactTaskBytes": true }
  }
}
