{
  "schema": "openprose.runner-case/1",
  "id": "core.opaque-argv",
  "summary": "Global parsing freezes at the language command and every later argument boundary is preserved.",
  "phase": 1,
  "tags": ["argv", "opaque", "unicode", "shell-neutral"],
  "controls": {
    "fixedInvocationId": "fixture-invocation-0001",
    "fixedTimestamp": "2025-01-01T00:00:00Z",
    "fixedMonotonicMs": 0,
    "network": "denied"
  },
  "invocation": {
    "argv": ["--harness", "mock", "--output", "json", "run", "path with spaces/example.prose.md", "--harness", "claude", "--model", "language-value", "雪", "", "line\nbreak", ";$(touch nope)", "*?[abc]"],
    "cwd": "{{WORKSPACE}}",
    "environment": {}
  },
  "expected": {
    "exitCode": 0,
    "stdout": { "kind": "json", "schema": "openprose.runner-result/1" },
    "stderr": { "kind": "empty" },
    "startedHarness": true,
    "forwardedTask": {
      "argv": ["prose", "run", "path with spaces/example.prose.md", "--harness", "claude", "--model", "language-value", "雪", "", "line\nbreak", ";$(touch nope)", "*?[abc]"],
      "interactionMode": "non-interactive"
    }
  }
}
