{
  "schema": "openprose.runner-case/1",
  "id": "operations.harness-use-prime-missing-bundle",
  "summary": "Selecting Prime without an explicit model and auth profile fails as actionable runner invocation syntax before persistence or harness startup.",
  "phase": 6,
  "tags": ["cli", "configuration", "agent-dx", "differential", "fail-closed", "saved-selection"],
  "controls": {
    "fixedInvocationId": "fixture-invocation-0001",
    "fixedTimestamp": "2025-01-01T00:00:00Z",
    "fixedMonotonicMs": 0,
    "network": "denied"
  },
  "invocation": {
    "argv": ["--output", "json", "cli", "harness", "use", "prime"],
    "cwd": "{{WORKSPACE}}",
    "environment": {
      "HOME": "{{WORKSPACE}}/home",
      "XDG_CONFIG_HOME": "{{WORKSPACE}}/config"
    }
  },
  "expected": {
    "exitCode": 2,
    "stdout": { "kind": "json", "schema": "openprose.runner-error/1" },
    "stderr": { "kind": "empty" },
    "startedHarness": false,
    "resultMatches": {
      "code": "INVOCATION_INVALID",
      "boundary": "invocation",
      "message": "Runner invocation is invalid.",
      "action": "Invoke the `cli harness use prime` runner operation with both the `--model` and `--auth-profile` options, then retry.",
      "exitCode": 2,
      "retryable": false,
      "details": {
        "adapterId": "prime/rpc",
        "reason": "Prime and OMP selection requires explicit CLI --model and --auth-profile options; inherited configuration does not select a credential route.",
        "requiredOptions": ["--model", "--auth-profile"],
        "supportedAuthProfiles": [
          "prime-harness-login",
          "anthropic",
          "openai",
          "openrouter",
          "google",
          "github-copilot",
          "aws-bedrock"
        ]
      }
    }
  }
}
