{
  "schema": "openprose.runner-case/1",
  "id": "operations.auth-status-unavailable",
  "summary": "The advertised OpenProse account status route fails at the hosted boundary rather than as unknown syntax.",
  "phase": 6,
  "tags": ["cli", "auth", "agent-dx", "differential", "no-secret"],
  "controls": {
    "fixedInvocationId": "fixture-invocation-0001",
    "fixedTimestamp": "2025-01-01T00:00:00Z",
    "fixedMonotonicMs": 0,
    "network": "denied"
  },
  "invocation": {
    "argv": ["--output", "json", "cli", "auth", "status"],
    "cwd": "{{WORKSPACE}}",
    "environment": {
      "HOME": "{{WORKSPACE}}/home",
      "XDG_CONFIG_HOME": "{{WORKSPACE}}/config"
    }
  },
  "expected": {
    "exitCode": 10,
    "stdout": { "kind": "json", "schema": "openprose.account-status/1" },
    "stderr": { "kind": "empty" },
    "startedHarness": false,
    "resultMatches": {
      "schema": "openprose.account-status/1",
      "availability": "unavailable",
      "authenticated": null,
      "authCategory": "openprose-account",
      "billingOwner": "openprose",
      "credentialStorage": "unavailable"
    }
  }
}
