{
  "schema": "openprose.runner-case/1",
  "id": "operations.harness-use-duplicate-model-suffix-json",
  "summary": "Both products preserve machine output and classify duplicate harness-selection model options as invalid runner syntax.",
  "phase": 6,
  "tags": ["cli", "configuration", "agent-dx", "differential", "fail-closed", "machine-output", "saved-selection"],
  "controls": {
    "fixedInvocationId": "fixture-invocation-0001",
    "fixedTimestamp": "2025-01-01T00:00:00Z",
    "fixedMonotonicMs": 0,
    "network": "denied"
  },
  "invocation": {
    "argv": [
      "cli",
      "harness",
      "use",
      "prime",
      "--model",
      "fixture/model",
      "--model",
      "other/model",
      "--auth-profile",
      "prime-harness-login",
      "--json"
    ],
    "cwd": "{{WORKSPACE}}",
    "environment": {
      "HOME": "{{WORKSPACE}}/home",
      "XDG_CONFIG_HOME": "{{WORKSPACE}}/config"
    }
  },
  "expected": {
    "exitCode": 2,
    "stdout": { "kind": "json", "schema": "openprose.runner-error/1" },
    "stderr": { "kind": "empty" },
    "startedHarness": false,
    "resultMatches": {
      "code": "INVOCATION_INVALID",
      "boundary": "invocation",
      "message": "Runner invocation is invalid.",
      "action": "Review the runner syntax with the --help option, place global options before cli, and retry the command.",
      "exitCode": 2,
      "retryable": false,
      "details": {
        "reason": "runner option --model was specified more than once"
      }
    }
  }
}
