{
  "schema": "openprose.runner-case/1",
  "id": "dx.dry-run-mock",
  "summary": "The explicit mock dry run reports exact test-only selection, auth, and configuration facts without starting a model.",
  "phase": 7,
  "tags": ["dry-run", "mock", "configuration", "agent-dx", "differential"],
  "controls": {
    "fixedInvocationId": "fixture-invocation-0001",
    "fixedTimestamp": "2025-01-01T00:00:00Z",
    "fixedMonotonicMs": 0,
    "network": "denied"
  },
  "invocation": {
    "argv": ["--harness", "mock", "--output", "json", "--dry-run", "write", "fixture request"],
    "cwd": "{{WORKSPACE}}",
    "environment": {}
  },
  "expected": {
    "exitCode": 0,
    "stdout": { "kind": "json", "schema": "openprose.runner-dry-run-report/1" },
    "stderr": { "kind": "empty" },
    "startedHarness": false,
    "resultFixture": "cli/shared/fixtures/dx/dry-run-mock.json"
  }
}
